17:33:40.245389 IP 198.96.84.204.40753 > 159.89.116.68.22: Flags [.], ack 72356, win 2046, length 0
17:33:40.289843 IP 198.96.84.204.40753 > 159.89.116.68.22: Flags [.], ack 72512, win 2046, length 0
17:33:40.337737 IP 159.89.116.68.22 > 198.96.84.204.40753: Flags [P.], seq 72512:72868, ack 37, win 501, length 356
17:33:40.385694 IP 198.96.84.204.40753 > 159.89.116.68.22: Flags [.], ack 72868, win 2044, length 0
17:33:40.441532 IP 159.89.116.68.22 > 198.96.84.204.40753: Flags [P.], seq 72868:73120, ack 37, win 501, length 252
17:33:40.496966 IP 198.96.84.204.40753 > 159.89.116.68.22: Flags [.], ack 73120, win 2044, length 0
17:33:40.545523 IP 159.89.116.68.22 > 198.96.84.204.40753: Flags [P.], seq 73120:73372, ack 37, win 501, length 252
17:33:40.591333 IP 198.96.84.204.40753 > 159.89.116.68.22: Flags [.], ack 73372, win 2047, length 0
17:33:40.649506 IP 159.89.116.68.22 > 198.96.84.204.40753: Flags [P.], seq 73372:73624, ack 37, win 501, length 252
17:33:40.700440 IP 198.96.84.204.40753 > 159.89.116.68.22: Flags [.], ack 73624, win 2046, length 0
17:33:40.753463 IP 159.89.116.68.22 > 198.96.84.204.40753: Flags [P.], seq 73624:73876, ack 37, win 501, length 252
17:33:40.809771 IP 198.96.84.204.40753 > 159.89.116.68.22: Flags [.], ack 73876, win 2046, length 0
17:33:40.857539 IP 159.89.116.68.22 > 198.96.84.204.40753: Flags [P.], seq 73876:74128, ack 37, win 501, length 252
17:33:40.903420 IP 198.96.84.204.40753 > 159.89.116.68.22: Flags [.], ack 74128, win 2045, length 0
17:33:40.961556 IP 159.89.116.68.22 > 198.96.84.204.40753: Flags [P.], seq 74128:74380, ack 37, win 501, length 252
17:33:41.015765 IP 198.96.84.204.40753 > 159.89.116.68.22: Flags [.], ack 74380, win 2044, length 0
17:33:41.065540 IP 159.89.116.68.22 > 198.96.84.204.40753: Flags [P.], seq 74380:74632, ack 37, win 501, length 252
17:33:41.125655 IP 198.96.84.204.40753 > 159.89.116.68.22: Flags [.], ack 74632, win 2047, length 0
^C
532 packets captured
537 packets received by filter
0 packets dropped by kernel